participantNo,inputType,trialNo,triad,msg,spagCorrect,correctMsg,gMsg
15,Speech,4,"swings.png,money.png,momandbaby.png",The mother noticed that there was some money on the ground near the swings,The mother noticed that there was some money on the ground near the swings,The mother noticed that there was some money on the ground near the swings,The mother noticed that there was some money on the ground near the swings
15,Speech,5,"baby.png,iPhone4.png,man.png",The man played on his cell phone while the baby watched,The man played on his cell phone while the baby watched,The man played on his cell phone while the baby watched,The man played on his cell phone while the baby watched
15,Speech,6,"soccer.png,youngman.png,heart.png",The man loves soccer.,The man loves soccer.,The man loves soccer.,The man loves soccer.
15,Speech,7,"brocoli.png,hotdog.png,woman.png",The lady found a piece of broccoli in her hot dog,The lady found a piece of broccoli in her hot dog,The lady found a piece of broccoli in her hot dog,The lady found a piece of broccoli in her hot dog
15,Speech,8,"boy.png,boat.png,cat.png",The boy noticed a cat jumping out of a sailboat,The boy noticed a cat jumping out of a sailboat,The boy noticed a cat jumping out of a sailboat,The boy noticed a cat jumping out of a sailboat
15,Speech,9,"crying.png,pup.png,confused.png",The dog and the lady were confused as to why the boy was crying,The dog and the lady were confused as to why the boy was crying,The dog and the lady were confused as to why the boy was crying,The dog and the lady were confused as to why the boy was crying
15,Speech,10,"flower.png,bench.png,man.png",The man found some flowers by the bench,The man found some flowers by the bench,The man found some flowers by the bench,The man found some flowers by the bench
15,Speech,11,"bicycle.png,youngman.png,santa.png",Santa Claus gifted the man a bike,Santa Claus gifted the man a bike,Santa Claus gifted the man a bike,Santa Claus gifted the man a bike
15,Speech,12,"teddybear.png,money.png,Friends.png",A group of people spend their money on buying a teddy bear,A group of people spend their money on buying a teddy bear,A group of people spend their money on buying a teddy bear,A group of people spend their money on buying a teddy bear
15,Speech,13,"apple.png,doctor.png,house.png",The doctor grew apples near his house,The doctor grew apples near his house,The doctor grew apples near his house,The doctor grew apples near his house
15,Speech,14,"house.png,Friends.png,mug.png",A group of people drink coffee inside the house,A group of people drink coffee inside the house,A group of people drink coffee inside the house,A group of people drink coffee inside the house
15,Speech,15,"swings.png,crying.png,raincloud.png",The boy was sad that those swings were wet because of the rain,The boy was sad that those swings were wet because of the rain,The boy was sad that those swings were wet because of the rain,The boy was sad that those swings were wet because of the rain
15,Speech,16,"grandma.png,heart.png,teddybear.png",The old woman love teddy bears,The old woman loves teddy bears,The old woman loves teddy bears,The old woman loves teddy bears
15,Speech,17,"crying.png,youngman.png,santa.png",The man took the crying boy to Santa Claus to cheer him up,The man took the crying boy to Santa Claus to cheer him up,The man took the crying boy to Santa Claus to cheer him up,The man took the crying boy to Santa Claus to cheer him up
15,Speech,18,"boy.png,Friends.png,present.png",A group of people bought a boy a present,A group of people bought a boy a present,A group of people bought a boy a present,A group of people bought a boy a present
15,Speech,19,"woman.png,momandbaby.png,plane.png",The flight attendant welcome the lady and her daughter into the airplane,The flight attendant welcomes the lady and her daughter into the airplane,The flight attendant welcomes the lady and her daughter into the airplane,The flight attendant welcomes the lady and her daughter into the airplane
15,Speech,20,"cooking.png,house.png,soccer.png",The lady who like to cook in her house also like playing soccer,The lady who like to cook in her house also like playing soccer,The lady who likes to cook in her house also likes playing soccer,The lady who like to cook in her house also like playing soccer
16,Speech,1,"turtle.png,cooking-pan.png,youngman.png",The boy's turtle likes to sit in the pan,The boy's turtle likes to sit in the pan,The boy's turtle likes to sit in the pan,The boy's turtle likes to sit in the pan
16,Speech,2,"soccer.png,youngman.png,heart.png",The man loves to watch football,The man loves to watch football,The man loves to watch football,The man loves to watch football
16,Speech,3,"cooking.png,house.png,soccer.png",The girl hosted a football game at her house,The girl hosted a football game at her house,The girl hosted a football game at her house,The girl hosted a football game at her house
16,Speech,4,"crying.png,pup.png,confused.png",The boy cried when his mother got him a puppy,The boy cried when his mother got him a puppy,The boy cried when his mother got him a puppy,The boy cried when his mother got him a puppy
16,Speech,5,"boy.png,boat.png,cat.png",The boy loves to play with toy boats and his cat,The boy loves to play with toy boats and his cat,The boy loves to play with toy boats and his cat,The boy loves to play with toy boats and his cat
16,Speech,6,"bicycle.png,youngman.png,santa.png",Santa Claus waved at the man while he rode his bicycle,Santa Claus waved at the man while he rode his bicycle,Santa Claus waved at the man while he rode his bicycle,Santa Claus waved at the man while he rode his bicycle
16,Speech,7,"swings.png,money.png,momandbaby.png",The mom paid some money to have a swing installed outside her house,The mom paid some money to have a swing installed outside her house,The mom paid some money to have a swing installed outside her house,The mom paid some money to have a swing installed outside her house
16,Speech,8,"crying.png,youngman.png,santa.png",The man's son was afraid of Santa Claus,The man's son was afraid of Santa Claus,The man's son was afraid of Santa Claus,The man's son was afraid of Santa Claus
16,Speech,9,"boy.png,Friends.png,present.png",The boy got a gift from his siblings,The boy got a gift from his siblings,The boy got a gift from his siblings,The boy got a gift from his siblings
16,Speech,10,"house.png,Friends.png,mug.png",The friends broke a mug at the hotel,The friends broke a mug at the hotel,The friends broke a mug at the hotel,The friends broke a mug at the hotel
16,Speech,11,"teddybear.png,money.png,Friends.png",The friends got a teddy bear with some money,The friends got a teddy bear with some money,The friends got a teddy bear with some money,The friends got a teddy bear with some money
16,Speech,12,"swings.png,crying.png,raincloud.png",The boy cried when he couldn't ride the swing because of the rain,The boy cried when he couldn't ride the swing because of the rain,The boy cried when he couldn't ride the swing because of the rain,The boy cried when he couldn't ride the swing because of the rain
16,Speech,13,"grandma.png,heart.png,teddybear.png",The grandma loves teddy bears,The grandma loves teddy bears,The grandma loves teddy bears,The grandma loves teddy bears
16,Speech,14,"baby.png,iPhone4.png,man.png",The man got his baby a new smartphone,The man got his baby a new smartphone,The man got his baby a new smartphone,The man got his baby a new smartphone
16,Speech,15,"doctor.png,plane.png,boy.png",The boy took a flight to see the doctor,The boy took a flight to see the doctor,The boy took a flight to see the doctor,The boy took a flight to see the doctor
16,Speech,16,"woman.png,momandbaby.png,plane.png",The mom took a flight with her baby to see her friend,The mom took a flight with her baby to see her friend,The mom took a flight with her baby to see her friend,The mom took a flight with her baby to see her friend
16,Speech,17,"flower.png,bench.png,man.png",The man admired the flowers while sitting on the bench,The man admired the flowers while sitting on the bench,The man admired the flowers while sitting on the bench,The man admired the flowers while sitting on the bench
16,Speech,18,"sun.png,house.png,baby.png",The baby enjoys sunny days outside his house,The baby enjoys sunny days outside his house,The baby enjoys sunny days outside his house,The baby enjoys sunny days outside his house
16,Speech,19,"brocoli.png,hotdog.png,woman.png",The woman thinks broccoli is better than hot dogs,The woman thinks broccoli is better than hot dogs,The woman thinks broccoli is better than hot dogs,The woman thinks broccoli is better than hot dogs
16,Speech,20,"apple.png,doctor.png,house.png",The doctor always brings apples to his house,The doctor always brings apples to his house,The doctor always brings apples to his house,The doctor always brings apples to his house
16,Keyboard,1,"swings.png,crying.png,raincloud.png",The boy cried when the swing got wet because of the rain,The boy cried when the swing got wet because of the rain,The boy cried when the swing got wet because of the rain,The boy cried when the swing got wet because of the rain
16,Keyboard,2,"crying.png,youngman.png,santa.png",Mom called Santa Claus to make the crying boy happy,Mom called Santa Claus to make the crying boy happy,Mom called Santa Claus to make the crying boy happy,Mom called Santa Claus to make the crying boy happy
16,Keyboard,3,"flower.png,bench.png,man.png",The man looked at the flowers while sitting on the bench in the park,The man looked at the flowers while sitting on the bench in the park,The man looked at the flowers while sitting on the bench in the park,The man looked at the flowers while sitting on the bench in the park
16,Keyboard,4,"soccer.png,youngman.png,heart.png",The woman loves to watch football,The woman loves to watch football,The woman loves to watch football,The woman loves to watch football
16,Keyboard,5,"bicycle.png,youngman.png,santa.png",The woman rode her bicycle to visit Santa Claus,The woman rode her bicycle to visit Santa Claus,The woman rode her bicycle to visit Santa Claus,The woman rode her bicycle to visit Santa Claus
16,Keyboard,6,"turtle.png,cooking-pan.png,youngman.png",The woman cooked a meal for the pet turtle,The woman cooked a meal for the pet turtle,The woman cooked a meal for the pet turtle,The woman cooked a meal for the pet turtle
16,Keyboard,7,"swings.png,money.png,momandbaby.png",The baby wanted to get a swing while the mother wanted to get money from the bank,The baby wanted to get a swing while the mother wanted to get money from the bank,The baby wanted to get a swing while the mother wanted to get money from the bank,The baby wanted to get a swing while the mother wanted to get money from the bank
16,Keyboard,8,"cooking.png,house.png,soccer.png",The mom cooked a meal for his son's friends while they played football,The mom cooked a meal for his son's friends while they played football,The mom cooked a meal for her son's friends while they played football,The mom cooked a meal for his son's friends while they played football
16,Keyboard,9,"baby.png,iPhone4.png,man.png",Dad's phone's ringtone makes the baby happy,Dad's phone's ringtone makes the baby happy,Dad's phone's ringtone makes the baby happy,Dad's phone's ringtone makes the baby happy
16,Keyboard,10,"boy.png,boat.png,cat.png",The boy and his cat sailed on the boat,The boy and his cat sailed on the boat,The boy and his cat sailed on the boat,The boy and his cat sailed on the boat
16,Keyboard,11,"house.png,Friends.png,mug.png",The neighbours had a tea party at the house,The neighbours had a tea party at the house,The neighbours had a tea party at the house,The neighbours had a tea party at the house
16,Keyboard,12,"crying.png,pup.png,confused.png",The mom was confused why her son was crying whenever the dog got closer,The mom was confused why her son was crying whenever the dog got closer,The mom was confused why her son was crying whenever the dog got closer,The mom was confused why her son was crying whenever the dog got closer
16,Keyboard,13,"grandma.png,heart.png,teddybear.png",The old with man loves the teddy bear she got as a gift,The old with man loves the teddy bear she got as a gift,The old with man loves the teddy bear she got as a gift,The old with man loves the teddy bear she got as a gift
16,Keyboard,14,"boy.png,Friends.png,present.png",The friends gave the boy a present,The friends gave the boy a present,The friends gave the boy a present,The friends gave the boy a present
16,Keyboard,15,"brocoli.png,hotdog.png,woman.png",The woman always preferred to eat broccoli over a hot dog,The woman always preferred to eat broccoli over a hot dog,The woman always preferred to eat broccoli over a hot dog,The woman always preferred to eat broccoli over a hot dog
16,Keyboard,16,"sun.png,house.png,baby.png",Sunny weather makes the baby happy,Sunny weather makes the baby happy,Sunny weather makes the baby happy,Sunny weather makes the baby happy
16,Keyboard,17,"apple.png,doctor.png,house.png",Apples are a staple at the doctor's house,Apples are a staple at the doctor's house,Apples are a staple at the doctor's house,Apples are a staple at the doctor's house
16,Keyboard,18,"doctor.png,plane.png,boy.png",The doctor took a flight to visit his son,The doctor took a flight to visit his son,The doctor took a flight to visit his son,The doctor took a flight to visit his son
16,Keyboard,19,"woman.png,momandbaby.png,plane.png",The family said goodbye to the friend before they took a flight,The family said goodbye to the friend before they took a flight,The family said goodbye to the friend before they took a flight,The family said goodbye to the friend before they took a flight
16,Keyboard,20,"teddybear.png,money.png,Friends.png",The friends chipped in money to get a teddy bear,The friends chipped in money to get a teddy bear,The friends chipped in money to get a teddy bear,The friends chipped in money to get a teddy bear
17,Keyboard,1,"crying.png,youngman.png,santa.png",I would often cry at the thought of not being able to meet Santa Claus on Christmas Eve when I was a child. ,I would often cry at the thought of not being able to meet Santa Claus on Christmas Eve when I was a child. ,I would often cry at the thought of not being able to meet Santa Claus on Christmas Eve when I was a child. ,I would often cry at the thought of not being able to meet Santa Claus on Christmas Eve when I was a child. 
17,Keyboard,2,"bicycle.png,youngman.png,santa.png","Even though I'm not a child anymore, I wouldn't mind receiving a bike for Christmas this year. ","Even though I'm not a child anymore, I wouldn't mind receiving a bike for Christmas this year. ","Even though I'm not a child anymore, I wouldn't mind receiving a bike for Christmas this year. ","Even though I'm not a child anymore, I wouldn't mind receiving a bike for Christmas this year. "
17,Keyboard,3,"swings.png,crying.png,raincloud.png",The boy is crying because he can't play on the swings due to the thunderstorm,The boy is crying because he can't play on the swings due to the thunderstorm,The boy is crying because he can't play on the swings due to the thunderstorm,The boy is crying because he can't play on the swings due to the thunderstorm
17,Keyboard,4,"flower.png,bench.png,man.png",The man likes to sit on the bench and gaze at sunflowers in the park.,The man likes to sit on the bench and gaze at sunflowers in the park.,The man likes to sit on the bench and gaze at sunflowers in the park.,The man likes to sit on the bench and gaze at sunflowers in the park.
17,Keyboard,5,"boy.png,boat.png,cat.png",The kid would like to take his cat on the boat but he is afraid she might fall sick. ,"The kid would like to take his cat on the boat, but he is afraid she might fall sick. ",The kid would like to take his cat on the boat but he is afraid she might fall sick. ,"The kid would like to take his cat on the boat, but he is afraid she might fall sick. "
17,Keyboard,6,"woman.png,momandbaby.png,plane.png",The air hostess advised the lady to look after her child when she heard there might be turbulence on the flight.,The air hostess advised the lady to look after her child when she heard there might be turbulence on the flight.,The air hostess advised the lady to look after her child when she heard there might be turbulence on the flight.,The air hostess advised the lady to look after her child when she heard there might be turbulence on the flight.
17,Keyboard,7,"teddybear.png,money.png,Friends.png",My friends pooled in their pocket money to gift me a teddy bear ,My friends pooled in their pocket money to gift me a teddy bear ,My friends pooled their pocket money to gift me a teddy bear ,My friends pooled in their pocket money to gift me a teddy bear 
17,Keyboard,8,"apple.png,doctor.png,house.png",My doctor joked about growing green apples at his house for his experiments when I met him last week. ,My doctor joked about growing green apples at his house for his experiments when I met him last week. ,My doctor joked about growing green apples at his house for his experiments when I met him last week. ,My doctor joked about growing green apples at his house for his experiments when I met him last week. 
17,Keyboard,9,"brocoli.png,hotdog.png,woman.png",I was surprised when the air hostess at Wendy's asked me to pick between hot dog and broccoli for lunch. ,I was surprised when the air hostess at Wendy's asked me to pick between hot dog and broccoli for lunch. ,I was surprised when the air hostess at Wendy's asked me to pick between hot dogs and broccoli for lunch. ,I was surprised when the air hostess at Wendy's asked me to pick between hot dog and broccoli for lunch. 
17,Keyboard,10,"soccer.png,youngman.png,heart.png",My love for soccer has no bounds. ,My love for soccer has no bounds. ,My love for soccer has no bounds. ,My love for soccer has no bounds. 
17,Keyboard,11,"sun.png,house.png,baby.png",I don't like leaving the kid alone in the house especially when it's sunny outside. ,I don't like leaving the kid alone in the house especially when it's sunny outside. ,I don't like leaving the kid alone in the house especially when it's sunny outside. ,I don't like leaving the kid alone in the house especially when it's sunny outside. 
17,Keyboard,12,"house.png,Friends.png,mug.png",I invited my friends from school for coffee at our house,I invited my friends from school for coffee at our house,I invited my friends from school for coffee at our house,I invited my friends from school for coffee at our house
17,Keyboard,13,"boy.png,Friends.png,present.png","Guys, let's buy something cute for the kid who lives in the shelter home down the street; it's his birthday next week.","Guys, let's buy something cute for the kid who lives in the shelter home down the street; it's his birthday next week.","Guys, let's buy something cute for the kid who lives in the shelter home down the street; it's his birthday next week.","Guys, let's buy something cute for the kid who lives in the shelter home down the street; it's his birthday next week."
17,Keyboard,14,"swings.png,money.png,momandbaby.png",The lady would like to install a swing in her front yard but she doesn't have the money for it right now. ,"The lady would like to install a swing in her front yard, but she doesn't have the money for it right now. ",The lady would like to install a swing in her front yard but she doesn't have the money for it right now. ,"The lady would like to install a swing in her front yard, but she doesn't have the money for it right now. "
17,Keyboard,15,"crying.png,pup.png,confused.png",I thought you liked my dog! Why are you crying? ,I thought you liked my dog! Why are you crying? ,I thought you liked my dog! Why are you crying? ,I thought you liked my dog! Why are you crying? 
17,Keyboard,16,"cooking.png,house.png,soccer.png","I will just stay back in the house and cook us all a nice dinner, you can go watch the game. ","I will just stay back in the house and cook us all a nice dinner, you can go watch the game. ","I will just stay back in the house and cook us all a nice dinner, you can go watch the game. ","I will just stay back in the house and cook us all a nice dinner, you can go watch the game. "
17,Keyboard,17,"turtle.png,cooking-pan.png,youngman.png","I didn't know tortoise meat was a thing, maybe I'll try making a dish out of it when I get back home tonight.","I didn't know tortoise meat was a thing, maybe I'll try making a dish out of it when I get back home tonight.","I didn't know tortoise meat was a thing, maybe I'll try making a dish out of it when I get back home tonight.","I didn't know tortoise meat was a thing, maybe I'll try making a dish out of it when I get back home tonight."
17,Keyboard,18,"baby.png,iPhone4.png,man.png",I don't want my kids to get addicted to mobile phones.,I don't want my kids to get addicted to mobile phones.,I don't want my kids to get addicted to mobile phones.,I don't want my kids to get addicted to mobile phones.
17,Keyboard,19,"grandma.png,heart.png,teddybear.png",Grandma would love to get a teddy bear for Children's day! She's so cute! ,Grandma would love to get a teddy bear for Children's day! She's so cute! ,Grandma would love to get a teddy bear for Children's day! She's so cute! ,Grandma would love to get a teddy bear for Children's day! She's so cute! 
17,Keyboard,20,"doctor.png,plane.png,boy.png",The doctor will take the last flight out of town tonight to see his kid,The doctor will take the last flight out of town tonight to see his kid,The doctor will take the last flight out of town tonight to see his kid,The doctor will take the last flight out of town tonight to see his kid
17,Speech,1,"boy.png,Friends.png,present.png",We should gift our youngest cousin something cute for his birthday,We should gift our youngest cousin something cute for his birthday,We should gift our youngest cousin something cute for his birthday,We should gift our youngest cousin something cute for his birthday
17,Speech,2,"house.png,Friends.png,mug.png",Do you guys want to come over to my house for coffee?,Do you guys want to come over to my house for coffee?,Do you guys want to come over to my house for coffee?,Do you guys want to come over to my house for coffee?
17,Speech,3,"woman.png,momandbaby.png,plane.png",The lady said goodbye to the girl and her sister when they were boarding the flight,The lady said goodbye to the girl and her sister when they were boarding the flight,The lady said goodbye to the girl and her sister when they were boarding the flight,The lady said goodbye to the girl and her sister when they were boarding the flight
17,Speech,4,"cooking.png,house.png,soccer.png",I like to watch soccer at my house when I'm cooking,I like to watch soccer at my house when I'm cooking,I like to watch soccer at my house when I'm cooking,I like to watch soccer at my house when I'm cooking
17,Speech,5,"swings.png,money.png,momandbaby.png",I didn't know I need money for my child to play on the swing,I didn't know I need money for my child to play on the swing,I didn't know I need money for my child to play on the swing,I didn't know I need money for my child to play on the swing
17,Speech,6,"crying.png,youngman.png,santa.png",The boy started crying when his dad told him Santa Claus won't be coming for Christmas,The boy started crying when his dad told him Santa Claus won't be coming for Christmas,The boy started crying when his dad told him Santa Claus won't be coming for Christmas,The boy started crying when his dad told him Santa Claus won't be coming for Christmas
17,Speech,7,"apple.png,doctor.png,house.png",Doctor wants to paint his house with the color of an apple,Doctor wants to paint his house with the color of an apple,Doctor wants to paint his house with the color of an apple,The doctor wants to paint his house with the color of an apple
17,Speech,8,"teddybear.png,money.png,Friends.png",We shouldn't buy an expensive teddy bear,We shouldn't buy an expensive teddy bear,We shouldn't buy an expensive teddy bear,We shouldn't buy an expensive teddy bear
17,Speech,9,"baby.png,iPhone4.png,man.png",My kid loves playing games on my phone,My kid loves playing games on my phone,My kid loves playing games on my phone,My kid loves playing games on my phone
17,Speech,10,"boy.png,boat.png,cat.png",The boy wants to take his cat on the boat,The boy wants to take his cat on the boat,The boy wants to take his cat on the boat,The boy wants to take his cat on the boat
17,Speech,11,"crying.png,pup.png,confused.png",Are you crying because the puppy ran away?,Are you crying because the puppy ran away?,Are you crying because the puppy ran away?,Are you crying because the puppy ran away?
17,Speech,12,"brocoli.png,hotdog.png,woman.png",My mom tells me broccoli pairs well with a hot dog,My mom tells me broccoli pairs well with a hot dog,My mom tells me broccoli pairs well with a hot dog,My mom tells me broccoli pairs well with a hot dog
17,Speech,13,"swings.png,crying.png,raincloud.png",I'm crying because the swing is all wet because of the rain,I'm crying because the swing is all wet because of the rain,I'm crying because the swing is all wet because of the rain,I'm crying because the swing is all wet because of the rain
17,Speech,14,"sun.png,house.png,baby.png",I'm surprised the kid likes to stay in the house even when it's sunny outside,I'm surprised the kid likes to stay in the house even when it's sunny outside,I'm surprised the kid likes to stay in the house even when it's sunny outside,I'm surprised the kid likes to stay in the house even when it's sunny outside
