participantNo,inputType,trialNo,triad,msg,spagCorrect,correctMsg,gMsg
7,Speech,9,"baby.png,iPhone4.png,man.png",The baby is playing with the old man's phone,The baby is playing with the old man's phone,The baby is playing with the old man's phone,The baby is playing with the old man's phone
7,Speech,10,"crying.png,youngman.png,santa.png",The man saw a kid crying near Santa,The man saw a kid crying near Santa,The man saw a kid crying near Santa,The man saw a kid crying near Santa
7,Speech,11,"soccer.png,youngman.png,heart.png",The boy loves playing with ball,The boy loves playing with ball,The boy loves playing with ball,The boy loves playing with the ball
7,Speech,12,"sun.png,house.png,baby.png",The baby likes when sun shines through the window of the house,The baby likes when sun shines through the window of the house,The baby likes when the sun shines through the window of the house,The baby likes when sun shines through the window of the house
7,Speech,13,"flower.png,bench.png,man.png",The man was sitting on the bench and looking at flowers,The man was sitting on the bench and looking at flowers,The man was sitting on the bench and looking at flowers,The man was sitting on the bench and looking at flowers
7,Speech,14,"turtle.png,cooking-pan.png,youngman.png",The turtle made food in the pan for the boy,The turtle made food in the pan for the boy,The turtle made food in the pan for the boy,The turtle made food in the pan for the boy
7,Speech,15,"doctor.png,plane.png,boy.png",The doctor advised the boy not to go on a flight,The doctor advised the boy not to go on a flight,The doctor advised the boy not to go on a flight,The doctor advised the boy not to go on a flight
7,Speech,16,"swings.png,money.png,momandbaby.png",The lady took her kids to swings and found some money there,The lady took her kids to swings and found some money there,The lady took her kids to swings and found some money there,The lady took her kids to the swings and found some money there
7,Speech,17,"apple.png,doctor.png,house.png",The doctor took a green apple to his home,The doctor took a green apple to his home,The doctor took a green apple to his home,The doctor took a green apple to his home
7,Speech,18,"boy.png,boat.png,cat.png",The boy loves playing with his cat and his boat,The boy loves playing with his cat and his boat,The boy loves playing with his cat and his boat,The boy loves playing with his cat and his boat
7,Speech,19,"swings.png,crying.png,raincloud.png",The boys started crying when he was swinging and it started raining,"The boys started crying when he was swinging, and it started raining",The boys started crying when he was swinging and it started raining,"The boy started crying when he was swinging, and it started raining"
7,Speech,20,"cooking.png,house.png,soccer.png",She likes to cook stay in the house and play football,She likes to cook stay in the house and play football,She likes to cook stay in the house and play football,"She likes to cook, stay in the house, and play football"
8,Speech,1,"baby.png,iPhone4.png,man.png",The man gave his phone to a baby,The man gave his phone to a baby,The man gave his phone to a baby,The man gave his phone to a baby
8,Speech,2,"house.png,Friends.png,mug.png",The three friends meet up for coffee at their house,The three friends meet up for coffee at their house,The three friends meet up for coffee at their house,The three friends meet up for coffee at their house
8,Speech,3,"soccer.png,youngman.png,heart.png",The man loves soccer,The man loves soccer,The man loves soccer,The man loves soccer
8,Speech,4,"crying.png,pup.png,confused.png",The mom questioned why her son was afraid of dogs,The mom questioned why her son was afraid of dogs,The mom questioned why her son was afraid of dogs,The mom questioned why her son was afraid of dogs
8,Speech,5,"brocoli.png,hotdog.png,woman.png",The lady suggested you should eat broccoli and not hot dogs,The lady suggested you should eat broccoli and not hot dogs,The lady suggested you should eat broccoli and not hot dogs,The lady suggested you should eat broccoli and not hot dogs
8,Speech,6,"doctor.png,plane.png,boy.png",The doctor said the baby is safe to go on an airplane,The doctor said the baby is safe to go on an airplane,The doctor said the baby is safe to go on an airplane,The doctor said the baby is safe to go on an airplane
8,Speech,7,"apple.png,doctor.png,house.png",The doctor ate an apple while at home,The doctor ate an apple while at home,The doctor ate an apple while at home,The doctor ate an apple while at home
8,Speech,8,"cooking.png,house.png,soccer.png",The girl made soup at home for her soccer team,The girl made soup at home for her soccer team,The girl made soup at home for her soccer team,The girl made soup at home for her soccer team
8,Speech,9,"sun.png,house.png,baby.png",The baby crawled outside his house in the sun,The baby crawled outside his house in the sun,The baby crawled outside his house in the sun,The baby crawled outside his house in the sun
8,Speech,10,"teddybear.png,money.png,Friends.png",The three friends paid money to build a bear,The three friends paid money to build a bear,The three friends paid money to build a bear,The three friends paid money to build a bear
8,Speech,11,"woman.png,momandbaby.png,plane.png",The flight attendant helped the lady and her baby on to the plane,The flight attendant helped the lady and her baby on to the plane,The flight attendant helped the lady and her baby on to the plane,The flight attendant helped the lady and her baby on to the plane
8,Speech,12,"boy.png,Friends.png,present.png",The three friends gave a gift to a little boy,The three friends gave a gift to a little boy,The three friends gave a gift to a little boy,The three friends gave a gift to a little boy
8,Speech,13,"flower.png,bench.png,man.png",The man looked at the daisies while sitting on a park bench,The man looked at the daisies while sitting on a park bench,The man looked at the daisies while sitting on a park bench,The man looked at the daisies while sitting on a park bench
8,Speech,14,"swings.png,crying.png,raincloud.png",The boy cried because he was not allowed to swing in the rain,The boy cried because he was not allowed to swing in the rain,The boy cried because he was not allowed to swing in the rain,The boy cried because he was not allowed to swing in the rain
8,Speech,15,"bicycle.png,youngman.png,santa.png",The man asked for a bicycle from Santa Claus,The man asked for a bicycle from Santa Claus,The man asked for a bicycle from Santa Claus,The man asked for a bicycle from Santa Claus
8,Speech,16,"boy.png,boat.png,cat.png",The boys cat was afraid of going in a boat,The boy’s cat was afraid of going in a boat,The boy's cat was afraid of going in a boat,The boy’s cat was afraid of going in a boat
8,Speech,17,"turtle.png,cooking-pan.png,youngman.png",The man cooked food on a frying pan for his turtle,The man cooked food on a frying pan for his turtle,The man cooked food on a frying pan for his turtle,The man cooked food on a frying pan for his turtle
8,Speech,18,"grandma.png,heart.png,teddybear.png",The old lady loves her teddy bear,The old lady loves her teddy bear,The old lady loves her teddy bear,The old lady loves her teddy bear
8,Speech,19,"crying.png,youngman.png,santa.png",The child cried because a man told him Santa wasn't real,The child cried because a man told him Santa wasn't real,The child cried because a man told him Santa wasn't real,The child cried because a man told him Santa wasn't real
8,Speech,20,"swings.png,money.png,momandbaby.png",A mom paid money for a swing set for her son,A mom paid money for a swing set for her son,A mom paid money for a swing set for her son,A mom paid money for a swing set for her son
8,Keyboard,1,"swings.png,crying.png,raincloud.png",The boy was upset because it started raining and he could not swing anymore,The boy was upset because it started raining and he could not swing anymore,The boy was upset because it started raining and he could not swing anymore,The boy was upset because it started raining and he could not swing anymore
8,Keyboard,2,"brocoli.png,hotdog.png,woman.png",The lady ate a hot dog instead of nasty broccoli,The lady ate a hot dog instead of nasty broccoli,The lady ate a hot dog instead of nasty broccoli,The lady ate a hot dog instead of nasty broccoli
8,Keyboard,3,"house.png,Friends.png,mug.png",The three friends went to the girl's house for coffee,The three friends went to the girl's house for coffee,The three friends went to the girl's house for coffee,The three friends went to the girl's house for coffee
8,Keyboard,4,"crying.png,pup.png,confused.png",The mother was unsure why the dog bit her crying son,The mother was unsure why the dog bit her crying son,The mother was unsure why the dog bit her crying son,The mother was unsure why the dog bit her crying son
8,Keyboard,5,"cooking.png,house.png,soccer.png",The girl made soup at her home while her kids played soccer,The girl made soup at her home while her kids played soccer,The girl made soup at her home while her kids played soccer,The girl made soup at her home while her kids played soccer
8,Keyboard,6,"bicycle.png,youngman.png,santa.png",The boy asked santa Claus for a bicycle for Christmas ,The boy asked Santa Claus for a bicycle for Christmas ,The boy asked Santa Claus for a bicycle for Christmas ,The boy asked Santa Claus for a bicycle for Christmas 
8,Keyboard,7,"turtle.png,cooking-pan.png,youngman.png",The boy made fried turtle for dinnee,The boy made fried turtle for dinner,The boy made fried turtle for dinner,The boy made fried turtle for dinner
8,Keyboard,8,"flower.png,bench.png,man.png",The man sat on a bench admiring the flowers,The man sat on a bench admiring the flowers,The man sat on a bench admiring the flowers,The man sat on a bench admiring the flowers
8,Keyboard,9,"sun.png,house.png,baby.png",The baby was happy to leave the house when the sun came out ,The baby was happy to leave the house when the sun came out ,The baby was happy to leave the house when the sun came out ,The baby was happy to leave the house when the sun came out 
8,Keyboard,10,"baby.png,iPhone4.png,man.png",The baby stole the phone from his dad,The baby stole the phone from his dad,The baby stole the phone from his dad,The baby stole the phone from his dad
8,Keyboard,11,"grandma.png,heart.png,teddybear.png",The grandma loves her stuffed bear,The grandma loves her stuffed bear,The grandma loves her stuffed bear,The grandma loves her stuffed bear
8,Keyboard,12,"crying.png,youngman.png,santa.png",The boy cried because his dad was Santa claus,The boy cried because his dad was Santa Claus,The boy cried because his dad was Santa Claus,The boy cried because his dad was Santa Claus
8,Keyboard,13,"soccer.png,youngman.png,heart.png",The man loves watching the soccer world cup,The man loves watching the soccer world cup,The man loves watching the soccer world cup,The man loves watching the soccer world cup
8,Keyboard,14,"boy.png,Friends.png,present.png",The three friends were given a gift by a young child,The three friends were given a gift by a young child,The three friends were given a gift by a young child,The three friends were given a gift by a young child
8,Keyboard,15,"teddybear.png,money.png,Friends.png",The three friends sold a vintage teddy bear for a lot of money,The three friends sold a vintage teddy bear for a lot of money,The three friends sold a vintage teddy bear for a lot of money,The three friends sold a vintage teddy bear for a lot of money
8,Keyboard,16,"apple.png,doctor.png,house.png",The doctor went home and ate an apple after work,The doctor went home and ate an apple after work,The doctor went home and ate an apple after work,The doctor went home and ate an apple after work
8,Keyboard,17,"boy.png,boat.png,cat.png",The boys toy sailboat was knocked over by the cat,The boys toy sailboat was knocked over by the cat,The boy's toy sailboat was knocked over by the cat,The boy's toy sailboat was knocked over by the cat
8,Keyboard,18,"woman.png,momandbaby.png,plane.png",The girl and her little brother said goodbye to their mom to go on an airplane and visit their dad,The girl and her little brother said goodbye to their mom to go on an airplane and visit their dad,The girl and her little brother said goodbye to their mom to go on an airplane and visit their dad,The girl and her little brother said goodbye to their mom to go on an airplane and visit their dad
8,Keyboard,19,"swings.png,money.png,momandbaby.png",The girl and her baby sold their old swing set for a lot of money,The girl and her baby sold their old swing set for a lot of money,The girl and her baby sold their old swing set for a lot of money,The girl and her baby sold their old swing set for a lot of money
8,Keyboard,20,"doctor.png,plane.png,boy.png",The doctor on the airplane gave the little boy a lollie pop,The doctor on the airplane gave the little boy a lolly pop,The doctor on the airplane gave the little boy a lolly pop,The doctor on the airplane gave the little boy a lollipop
9,Keyboard,1,"bicycle.png,youngman.png,santa.png",The man asked santa Claus for a cycle,The man asked Santa Claus for a cycle,The man asked Santa Claus for a cycle,
9,Keyboard,2,"baby.png,iPhone4.png,man.png",I wanted to take photos of my baby to show him when he's older ,I wanted to take photos of my baby to show him when he's older ,I wanted to take photos of my baby to show him when he's older ,
9,Keyboard,3,"teddybear.png,money.png,Friends.png",All the kids bought teddy bears with their money. ,All the kids bought teddy bears with their money. ,All the kids bought teddy bears with their money. ,
9,Keyboard,4,"soccer.png,youngman.png,heart.png",The boy loves football ,The boy loves football ,The boy loves football ,
9,Keyboard,5,"brocoli.png,hotdog.png,woman.png",The girl prefers hotdogs over brocolli ,The girl prefers hotdogs over broccoli ,The girl prefers hotdogs over broccoli ,
9,Keyboard,6,"swings.png,crying.png,raincloud.png",The boy cried when he couldn't play on the swings because of the rain ,The boy cried when he couldn't play on the swings because of the rain ,The boy cried when he couldn't play on the swings because of the rain ,
9,Keyboard,7,"crying.png,youngman.png,santa.png",The young man you see today used to cry when Santa Claus didn't bring him presents when he was younger ,The young man you see today used to cry when Santa Claus didn't bring him presents when he was younger ,The young man you see today used to cry when Santa Claus didn't bring him presents when he was younger ,
9,Keyboard,8,"sun.png,house.png,baby.png",The baby likes to play outside his home in the sun ,The baby likes to play outside his home in the sun ,The baby likes to play outside his home in the sun ,
9,Keyboard,9,"swings.png,money.png,momandbaby.png",The parents paid good money to have their kids play on the playground ,The parents paid good money to have their kids play on the playground ,The parents paid good money to have their kids play on the playground ,
9,Keyboard,10,"apple.png,doctor.png,house.png",The doctor recommended planting apple trees outside their homeb,The doctor recommended planting apple trees outside their home,The doctor recommended planting apple trees outside their home,
9,Keyboard,11,"crying.png,pup.png,confused.png",The boys mother nor his dog couldn't understand why he was crying ,The boy’s mother nor his dog couldn't understand why he was crying ,The boy's mother nor his dog couldn't understand why he was crying ,
9,Keyboard,12,"house.png,Friends.png,mug.png",The kids went home for a cup of milk after playing all day ,The kids went home for a cup of milk after playing all day ,The kids went home for a cup of milk after playing all day ,
9,Keyboard,13,"grandma.png,heart.png,teddybear.png",My granny loves teddies ,My granny loves teddies ,My granny loves teddies ,
9,Keyboard,14,"cooking.png,house.png,soccer.png","My daughter loves cooking, football, and playing around the house ","My daughter loves cooking, football, and playing around the house ","My daughter loves cooking, football, and playing around the house ",
9,Keyboard,15,"woman.png,momandbaby.png,plane.png",The flight attendant was friendly to the family ,The flight attendant was friendly to the family ,The flight attendant was friendly to the family ,
9,Keyboard,16,"boy.png,Friends.png,present.png",His older friends got him many presents ,His older friends got him many presents ,His older friends got him many presents ,
9,Keyboard,17,"doctor.png,plane.png,boy.png",The doctor has recommended the boy not fly just yet,The doctor has recommended the boy not fly just yet,The doctor has recommended the boy not fly just yet,
9,Keyboard,18,"turtle.png,cooking-pan.png,youngman.png",The turtle was too slow to escape the man chasing him with a frying pan ,The turtle was too slow to escape the man chasing him with a frying pan ,The turtle was too slow to escape the man chasing him with a frying pan ,
9,Keyboard,19,"flower.png,bench.png,man.png",The man likes sitting in the park,The man likes sitting in the park,The man likes sitting in the park,
9,Keyboard,20,"boy.png,boat.png,cat.png",Only cats and men are allowed on pirate ships ,Only cats and men are allowed on pirate ships ,Only cats and men are allowed on pirate ships ,
9,Speech,1,"turtle.png,cooking-pan.png,youngman.png",The turtle jumped out of the frying pan and into the man's lap,The turtle jumped out of the frying pan and into the man's lap,The turtle jumped out of the frying pan and into the man's lap,
9,Speech,2,"doctor.png,plane.png,boy.png",The man jumped out of the plane to save the little boy,The man jumped out of the plane to save the little boy,The man jumped out of the plane to save the little boy,
9,Speech,3,"flower.png,bench.png,man.png",The man sat on the bench and plucked  nearby flowers,The man sat on the bench and plucked nearby flowers,The man sat on the bench and plucked nearby flowers,
9,Speech,4,"grandma.png,heart.png,teddybear.png",The teddy bear loves his grandma,The teddy bear loves his grandma,The teddy bear loves his grandma,
9,Speech,5,"boy.png,Friends.png,present.png",The little boy and his friends went shopping and got themselves lots of presents,The little boy and his friends went shopping and got themselves lots of presents,The little boy and his friends went shopping and got themselves lots of presents,
9,Speech,6,"crying.png,pup.png,confused.png",The woman was wondering why the boy was crying and the dog was wondering the same thing,The woman was wondering why the boy was crying and the dog was wondering the same thing,The woman was wondering why the boy was crying and the dog was wondering the same thing,
9,Speech,7,"swings.png,money.png,momandbaby.png",It takes a lot of money to get clean playgrounds,It takes a lot of money to get clean playgrounds,It takes a lot of money to get clean playgrounds,
9,Speech,8,"swings.png,crying.png,raincloud.png",Rain rain go away come again another day,Rain rain go away come again another day,Rain rain go away come again another day,
9,Speech,9,"woman.png,momandbaby.png,plane.png",The woman dreamed of being an air hostess for a very big airline someday,The woman dreamed of being an air hostess for a very big airline someday,The woman dreamed of being an air hostess for a very big airline someday,
9,Speech,10,"boy.png,boat.png,cat.png",The boy took his cat onto the ship,The boy took his cat onto the ship,The boy took his cat onto the ship,
9,Speech,11,"bicycle.png,youngman.png,santa.png",The man cycled his way to the North Pole,The man cycled his way to the North Pole,The man cycled his way to the North Pole,
9,Speech,12,"apple.png,doctor.png,house.png",The doctor didn't eat apples while he was at his home,The doctor didn't eat apples while he was at his home,The doctor didn't eat apples while he was at his home,
9,Speech,13,"baby.png,iPhone4.png,man.png",The baby got so happy when his dad give him his phone,The baby got so happy when his dad gave him his phone,The baby got so happy when his dad gives him his phone,
9,Speech,14,"cooking.png,house.png,soccer.png",The lady liked  to go home after a good game of soccer and eat,The lady liked to go home after a good game of soccer and eat,The lady liked to go home after a good game of soccer and eat,
9,Speech,15,"soccer.png,youngman.png,heart.png",The man was torn between his love and his love for soccer,The man was torn between his love and his love for soccer,The man was torn between his love and his love for soccer,
9,Speech,16,"sun.png,house.png,baby.png",The sun laughed at the baby while the baby was laughing in the house,The sun laughed at the baby while the baby was laughing in the house,The sun laughed at the baby while the baby was laughing in the house,
9,Speech,17,"teddybear.png,money.png,Friends.png",DD teddy bears cost a lot of money and the kids saved up for them,DD teddy bears cost a lot of money and the kids saved up for them,The teddy bears cost a lot of money and the kids saved up for them,
9,Speech,18,"brocoli.png,hotdog.png,woman.png",Broccolis are much healthier for you than hot dogs that's what my teacher said,Broccolis are much healthier for you than hot dogs that's what my teacher said,Broccolis are much healthier for you than hot dogs; that's what my teacher said,
9,Speech,19,"crying.png,youngman.png,santa.png",The young boy cried when he found out his dad was Santa Claus,The young boy cried when he found out his dad was Santa Claus,The young boy cried when he found out his dad was Santa Claus,
9,Speech,20,"house.png,Friends.png,mug.png",The kids threw hot chocolate on the house that gave them no candy,The kids threw hot chocolate on the house that gave them no candy,The kids threw hot chocolate on the house that gave them no candy,
10,Speech,1,"swings.png,crying.png,raincloud.png",The boy was crying because it was raining and he couldn't play,"The boy was crying because it was raining, and he couldn't play",The boy was crying because it was raining and he couldn't play,
10,Speech,2,"boy.png,boat.png,cat.png",The boys took his cat on the ship,The boys took his cat on the ship,The boys took his cat on the ship,
10,Speech,3,"sun.png,house.png,baby.png",The baby looked happy in the pink house and it was sunny outside,The baby looked happy in the pink house and it was sunny outside,The baby looked happy in the pink house and it was sunny outside,
10,Speech,4,"doctor.png,plane.png,boy.png",The boy and the doctor took a plane trip,The boy and the doctor took a plane trip,The boy and the doctor took a plane trip,
10,Speech,5,"house.png,Friends.png,mug.png",They met at the pink house for coffee,They met at the pink house for coffee,They met at the pink house for coffee,
10,Speech,6,"baby.png,iPhone4.png,man.png",The baby is watching cartoons on the iPhone,The baby is watching cartoons on the iPhone,The baby is watching cartoons on the iPhone,
10,Speech,7,"brocoli.png,hotdog.png,woman.png",The woman had hot dogs and broccoli for lunch,The woman had hot dogs and broccoli for lunch,The woman had hot dogs and broccoli for lunch,
10,Speech,8,"teddybear.png,money.png,Friends.png",The group of friends bought the teddy bear for $1000000,The group of friends bought the teddy bear for $1000000,The group of friends bought the teddy bear for $1000000,
10,Speech,9,"swings.png,money.png,momandbaby.png",The woman was charged $10 for using the swing,The woman was charged $10 for using the swing,The woman was charged $10 for using the swing,
10,Speech,10,"woman.png,momandbaby.png,plane.png",The woman called a stewardess for a glass of milk,The woman called a stewardess for a glass of milk,The woman called a stewardess for a glass of milk,
10,Speech,11,"crying.png,youngman.png,santa.png",The boy was upset with his father for not taking him to visit Santa Claus,The boy was upset with his father for not taking him to visit Santa Claus,The boy was upset with his father for not taking him to visit Santa Claus,
10,Speech,12,"apple.png,doctor.png,house.png",The doctor has an apple garden by his Pink House,The doctor has an apple garden by his Pink House,The doctor has an apple garden by his pink house,
10,Speech,13,"flower.png,bench.png,man.png",The old man sat at the bench and looked at flowers,The old man sat at the bench and looked at flowers,The old man sat at the bench and looked at flowers,
10,Speech,14,"cooking.png,house.png,soccer.png",The woman is making stew for the football team at The Pink House,The woman is making stew for the football team at The Pink House,The woman is making stew for the football team at the pink house,
10,Speech,15,"turtle.png,cooking-pan.png,youngman.png",The man is making turtles for lunch,The man is making turtles for lunch,The man is making turtles for lunch,
10,Speech,16,"boy.png,Friends.png,present.png",Group of friends gave her a baby as a gift,Group of friends gave her a baby as a gift,The group of friends gave her a baby as a gift,
10,Speech,17,"bicycle.png,youngman.png,santa.png",The boy wished that Santa Claus would give him a bicycle for Christmas,The boy wished that Santa Claus would give him a bicycle for Christmas,The boy wished that Santa Claus would give him a bicycle for Christmas,
10,Speech,18,"grandma.png,heart.png,teddybear.png",The dirty players loves the old woman,The dirty players love the old woman,The dirty players love the old woman,
10,Speech,19,"crying.png,pup.png,confused.png",A dog bit the boy and the girl was confused why it would do so,A dog bit the boy and the girl was confused why it would do so,A dog bit the boy and the girl was confused why it would do so,
10,Speech,20,"soccer.png,youngman.png,heart.png",The boy loves football,The boy loves football,The boy loves football,
